Catalogador,id,Categoría,name,type,desc,atk,def,level,race,attribute,archetype,set_tag,setcode,ban_tcg,ban_ocg,ban_goat,image_url,image_url_small,booster_oficial,LON,LOD,PGD,MFC,DCR
Nico,85562745,C,Dark Room of Nightmare,Spell Card,"Each time your opponent takes damage from a card effect, except ""Dark Room of Nightmare"", inflict 300 damage to your opponent.",,,,Continuous,,,"PGD-082,RP02-EN078,SDMA-EN024,DR1-EN030,SD3-EN022,","Pharaonic Guardian,Retro Pack 2,Structure Deck: Marik (TCG),Dark Revelation Volume 1,Structure Deck: Blaze of Destruction,",,,,https://storage.googleapis.com/ygoprodeck.com/pics/85562745.jpg,https://storage.googleapis.com/ygoprodeck.com/pics_small/85562745.jpg,PGD,FALSE,FALSE,TRUE,FALSE,FALSE
Eze,53982768,UR,Dark Ruler Ha Des,Effect Monster,Cannot be Special Summoned from the Graveyard. Negate the effects of monsters destroyed by battle with Fiend-Type monsters you control.,2450,1600,6,Fiend,DARK,,"CP05-EN008,BP01-EN122,MC1-EN006,BP01-EN122,LOD-001,DB2-EN124,RP02-EN052,LOD-EN001,","Champion Pack: Game Five,Battle Pack: Epic Dawn,Master Collection Volume 1,Battle Pack: Epic Dawn,Legacy of Darkness,Dark Beginning 2,Retro Pack 2,Legacy of Darkness,",,,,https://storage.googleapis.com/ygoprodeck.com/pics/53982768.jpg,https://storage.googleapis.com/ygoprodeck.com/pics_small/53982768.jpg,LOD,FALSE,TRUE,FALSE,FALSE,FALSE
Eze,61587183,R,Dark Scorpion - Chick the Yellow,Effect Monster,"When this card inflicts Battle Damage to your opponent, you can activate 1 of these effects:\n● Target 1 card on the field; return that target to the hand.\n● Look at the top card of their Deck, then return it to the top or bottom of the Deck.",1000,1000,3,Warrior,DARK,Dark Scorpion,"DCR-026,GLD5-EN010,DR1-EN188,DCR-EN026,","Dark Crisis,Gold Series: Haunted Mine,Dark Revelation Volume 1,Dark Crisis,",,,Semi-Limited,https://storage.googleapis.com/ygoprodeck.com/pics/61587183.jpg,https://storage.googleapis.com/ygoprodeck.com/pics_small/61587183.jpg,DCR,FALSE,FALSE,FALSE,FALSE,TRUE
Eze,6967870,C,Dark Scorpion - Cliff the Trap Remover,Effect Monster,"When this card inflicts Battle Damage to your opponent, you can activate 1 of these effects:\n● Target 1 Spell/Trap Card on the field; destroy that target.\n● Send the top 2 cards of their Deck to the Graveyard.",1200,1000,3,Warrior,DARK,Dark Scorpion,"DR1-EN133,MFC-078,GLD5-EN007,","Dark Revelation Volume 1,Magician's Force,Gold Series: Haunted Mine,",,,,https://storage.googleapis.com/ygoprodeck.com/pics/6967870.jpg,https://storage.googleapis.com/ygoprodeck.com/pics_small/6967870.jpg,MFC,FALSE,FALSE,FALSE,TRUE,FALSE
Nico,6967870,C,Dark Scorpion - Cliff the Trap Remover,Effect Monster,"When this card inflicts Battle Damage to your opponent, you can activate 1 of these effects:\n● Target 1 Spell/Trap Card on the field; destroy that target.\n● Send the top 2 cards of their Deck to the Graveyard.",1200,1000,3,Warrior,DARK,Dark Scorpion,"DR1-EN133,MFC-078,GLD5-EN007,","Dark Revelation Volume 1,Magician's Force,Gold Series: Haunted Mine,",,,,https://storage.googleapis.com/ygoprodeck.com/pics/6967870.jpg,https://storage.googleapis.com/ygoprodeck.com/pics_small/6967870.jpg,MFC,FALSE,FALSE,FALSE,TRUE,FALSE
Eze,48768179,R,Dark Scorpion - Gorg the Strong,Effect Monster,"When this card inflicts Battle Damage to your opponent, you can activate 1 of these effects:\n● Target 1 monster your opponent controls; return that target to the top of the Deck.\n● Send the top card of their Deck to the Graveyard. ",1800,1500,5,Warrior,DARK,Dark Scorpion,"DR1-EN222,DCR-060,GLD5-EN011,DCR-EN060,","Dark Revelation Volume 1,Dark Crisis,Gold Series: Haunted Mine,Dark Crisis,",,,,https://storage.googleapis.com/ygoprodeck.com/pics/48768179.jpg,https://storage.googleapis.com/ygoprodeck.com/pics_small/48768179.jpg,DCR,FALSE,FALSE,FALSE,FALSE,TRUE
Eze,74153887,R,Dark Scorpion - Meanae the Thorn,Effect Monster,"When this card inflicts Battle Damage to your opponent, you can activate 1 of these effects:\n● Add 1 ""Dark Scorpion"" card from your Deck to your hand.\n● Target 1 ""Dark Scorpion"" card in your Graveyard; add that target to your hand.",1000,1800,4,Warrior,DARK,Dark Scorpion,"DR1-EN223,DCR-061,GLD5-EN012,DCR-EN061,","Dark Revelation Volume 1,Dark Crisis,Gold Series: Haunted Mine,Dark Crisis,",,,,https://storage.googleapis.com/ygoprodeck.com/pics/74153887.jpg,https://storage.googleapis.com/ygoprodeck.com/pics_small/74153887.jpg,DCR,FALSE,FALSE,FALSE,FALSE,TRUE
Nico,40933924,C,Dark Scorpion Burglars,Effect Monster,When this card inflicts Battle Damage to your opponent: Your opponent sends 1 Spell Card from their Deck to the Graveyard.,1000,1000,4,Warrior,DARK,Dark Scorpion,"DB2-EN227,GLD5-EN004,PGD-028,","Dark Beginning 2,Gold Series: Haunted Mine,Pharaonic Guardian,",,,,https://storage.googleapis.com/ygoprodeck.com/pics/40933924.jpg,https://storage.googleapis.com/ygoprodeck.com/pics_small/40933924.jpg,PGD,FALSE,FALSE,TRUE,FALSE,FALSE
Eze,20858318,C,Dark Scorpion Combination,Trap Card,"You can only activate this card when there are ""Don Zaloog"", ""Cliff the Trap Remover"", ""Dark Scorpion - Chick the Yellow"", ""Dark Scorpion - Gorg the Strong"", and ""Dark Scorpion - Meanae the Thorn"" face-up on your side of the field. During this turn, any of these 5 cards can attack your opponent's Life Points directly. In that case, the Battle Damage inflicted to your opponent by each of those cards becomes 400 points.",,,,Normal,,Dark Scorpion,"DCR-098,DR1-EN260,DCR-EN098,","Dark Crisis,Dark Revelation Volume 1,Dark Crisis,",,,,https://storage.googleapis.com/ygoprodeck.com/pics/20858318.jpg,https://storage.googleapis.com/ygoprodeck.com/pics_small/20858318.jpg,DCR,FALSE,FALSE,FALSE,FALSE,TRUE
Nico,47233801,R,Dark Snake Syndrome,Spell Card,During each of your Standby Phases: Inflict damage to both players. This damage begins at 200 and is doubled during each of your following Standby Phases.,,,,Continuous,,,"DR1-EN035,LCYW-EN271,PGD-087,","Dark Revelation Volume 1,Legendary Collection 3: Yugi's World Mega Pack,Pharaonic Guardian,",,,,https://storage.googleapis.com/ygoprodeck.com/pics/47233801.jpg,https://storage.googleapis.com/ygoprodeck.com/pics_small/47233801.jpg,PGD,FALSE,FALSE,TRUE,FALSE,FALSE
Eze,93599951,SR,Dark Spirit of the Silent,Trap Card,"Activate only when an opponent's monster declares an attack. Negate that attack, and select another face-up monster your opponent controls. That monster attacks instead. (If it is in face-up Defense Position, change it to Attack Position.)",,,,Normal,,,"RP02-EN044,DB2-EN013,LON-079,LON-E079,LON-EN079,","Retro Pack 2,Dark Beginning 2,Labyrinth of Nightmare,Labyrinth of Nightmare,Labyrinth of Nightmare,",,,,https://storage.googleapis.com/ygoprodeck.com/pics/93599951.jpg,https://storage.googleapis.com/ygoprodeck.com/pics_small/93599951.jpg,LON,TRUE,FALSE,FALSE,FALSE,FALSE
Eze,35798491,R,Darkbishop Archfiend,Effect Monster,"The controller of this card pays 500 Life Points during each of his/her Standby Phases (this is not optional). When an Archfiend Monster Card on your side of the field is targeted by the effect of a card controlled by your opponent, when resolving the effect, roll a six-sided die. If the result is 1, 3, or 6, negate the effect and destroy the opponent's card.",300,1400,3,Fiend,WATER,Archfiend,"DCR-069,DR1-EN231,DCR-EN069,","Dark Crisis,Dark Revelation Volume 1,Dark Crisis,",,,,https://storage.googleapis.com/ygoprodeck.com/pics/35798491.jpg,https://storage.googleapis.com/ygoprodeck.com/pics_small/35798491.jpg,DCR,FALSE,FALSE,FALSE,FALSE,TRUE
Eze,57579381,C,Darklord Marie,Effect Monster,"Once per turn, during your Standby Phase: You gain 200 LP. This card must be in the Graveyard to activate and to resolve this effect.",1700,1200,5,Fiend,DARK,Darklord,"DESO-EN046,LON-046,DB1-EN241,LON-E046,LON-EN046,","Destiny Soldiers,Labyrinth of Nightmare,Dark Beginning 1,Labyrinth of Nightmare,Labyrinth of Nightmare,",,,,https://storage.googleapis.com/ygoprodeck.com/pics/57579381.jpg,https://storage.googleapis.com/ygoprodeck.com/pics_small/57579381.jpg,LON,TRUE,FALSE,FALSE,FALSE,FALSE
Eze,95286165,R,De-Fusion,Spell Card,"Target 1 Fusion Monster on the field; return that target to the Extra Deck, then, if all the Fusion Materials that were used for its Fusion Summon are in your Graveyard, you can Special Summon all of them.",,,,Quick-Play,,,"DP04-EN017,LCYW-EN063,YGLD-ENB31,SDMY-EN032,DB2-EN029,DT04-EN094,LCKC-EN044,LON-097,LON-EN097,LON-E097,","Duelist Pack: Zane Truesdale,Legendary Collection 3: Yugi's World Mega Pack,Yugi's Legendary Decks,Structure Deck: Yugi Muto,Dark Beginning 2,Duel Terminal 4,Legendary Collection Kaiba Mega Pack,Labyrinth of Nightmare,Labyrinth of Nightmare,Labyrinth of Nightmare,",,,,https://storage.googleapis.com/ygoprodeck.com/pics/95286165.jpg,https://storage.googleapis.com/ygoprodeck.com/pics_small/95286165.jpg,LON,TRUE,FALSE,FALSE,FALSE,FALSE
Eze,69122763,R,Deal of Phantom,Trap Card,Select 1 face-up monster on the field. Increase the selected monster's ATK by 100 points for each monster in your Graveyard during the turn this card is activated. The number of monsters is applied when this card is activated.,,,,Normal,,,"LON-084,LON-E084,LON-EN084,","Labyrinth of Nightmare,Labyrinth of Nightmare,Labyrinth of Nightmare,",,,,https://storage.googleapis.com/ygoprodeck.com/pics/69122763.jpg,https://storage.googleapis.com/ygoprodeck.com/pics_small/69122763.jpg,LON,TRUE,FALSE,FALSE,FALSE,FALSE
Nico,10209545,C,Decayed Commander,Effect Monster,"When this card is Normal Summoned successfully, you can Special Summon 1 ""Zombie Tiger"" from your hand. If this card successfully attacks your opponent's Life Points directly, your opponent discards 1 card randomly from his/her hand.",1000,1500,4,Zombie,EARTH,,"DR1-EN065,MFC-010,","Dark Revelation Volume 1,Magician's Force,",,,,https://storage.googleapis.com/ygoprodeck.com/pics/10209545.jpg,https://storage.googleapis.com/ygoprodeck.com/pics_small/10209545.jpg,MFC,FALSE,FALSE,FALSE,TRUE,FALSE
Nico,10209545,C,Decayed Commander,Effect Monster,"When this card is Normal Summoned successfully, you can Special Summon 1 ""Zombie Tiger"" from your hand. If this card successfully attacks your opponent's Life Points directly, your opponent discards 1 card randomly from his/her hand.",1000,1500,4,Zombie,EARTH,,"DR1-EN065,MFC-010,","Dark Revelation Volume 1,Magician's Force,",,,,https://storage.googleapis.com/ygoprodeck.com/pics/10209545.jpg,https://storage.googleapis.com/ygoprodeck.com/pics_small/10209545.jpg,MFC,FALSE,FALSE,FALSE,TRUE,FALSE
Nico,72575145,C,Demotion,Spell Card,Downgrade the monster equipped with this card by 2 Levels.,,,,Equip,,,"MFC-029,DR1-EN084,","Magician's Force,Dark Revelation Volume 1,",,,,https://storage.googleapis.com/ygoprodeck.com/pics/72575145.jpg,https://storage.googleapis.com/ygoprodeck.com/pics_small/72575145.jpg,MFC,FALSE,FALSE,FALSE,TRUE,FALSE
Nico,72575145,C,Demotion,Spell Card,Downgrade the monster equipped with this card by 2 Levels.,,,,Equip,,,"MFC-029,DR1-EN084,","Magician's Force,Dark Revelation Volume 1,",,,,https://storage.googleapis.com/ygoprodeck.com/pics/72575145.jpg,https://storage.googleapis.com/ygoprodeck.com/pics_small/72575145.jpg,MFC,FALSE,FALSE,FALSE,TRUE,FALSE
Nico,12965761,SR,Des Dendle,Union Effect Monster,"Once per turn, during your Main Phase, if you control this monster on the field, you can equip it to your ""Vampire Orchis"" as an Equip Card, OR unequip the Union equipment and Special Summon this card in face-up Attack Position. While equipped to a monster by this card's effect, each time the equipped monster destroys 1 of your opponent's monsters, Special Summon 1 ""Wicked Plant Token"" (Plant-Type/EARTH/1 Star/ATK 800/DEF 800). (1 monster can only be equipped with 1 Union Monster at a time. If the equipped monster is destroyed as a result of battle, destroy this card instead.)",300,2000,4,Plant,EARTH,,"DR1-EN070,MFC-015,","Dark Revelation Volume 1,Magician's Force,",,,,https://storage.googleapis.com/ygoprodeck.com/pics/12965761.jpg,https://storage.googleapis.com/ygoprodeck.com/pics_small/12965761.jpg,MFC,FALSE,FALSE,FALSE,TRUE,FALSE
Nico,12965761,SR,Des Dendle,Union Effect Monster,"Once per turn, during your Main Phase, if you control this monster on the field, you can equip it to your ""Vampire Orchis"" as an Equip Card, OR unequip the Union equipment and Special Summon this card in face-up Attack Position. While equipped to a monster by this card's effect, each time the equipped monster destroys 1 of your opponent's monsters, Special Summon 1 ""Wicked Plant Token"" (Plant-Type/EARTH/1 Star/ATK 800/DEF 800). (1 monster can only be equipped with 1 Union Monster at a time. If the equipped monster is destroyed as a result of battle, destroy this card instead.)",300,2000,4,Plant,EARTH,,"DR1-EN070,MFC-015,","Dark Revelation Volume 1,Magician's Force,",,,,https://storage.googleapis.com/ygoprodeck.com/pics/12965761.jpg,https://storage.googleapis.com/ygoprodeck.com/pics_small/12965761.jpg,MFC,FALSE,FALSE,FALSE,TRUE,FALSE
Eze,81985784,SR,Des Feral Imp,Flip Effect Monster,FLIP: Target 1 card in your Graveyard; shuffle that target into the Deck.,1600,1800,4,Reptile,DARK,,"YSKR-EN015,DR1-EN176,SDKS-EN014,DCR-014,DCR-EN014,","Starter Deck: Kaiba Reloaded,Dark Revelation Volume 1,Structure Deck: Seto Kaiba,Dark Crisis,Dark Crisis,",,,,https://storage.googleapis.com/ygoprodeck.com/pics/81985784.jpg,https://storage.googleapis.com/ygoprodeck.com/pics_small/81985784.jpg,DCR,FALSE,FALSE,FALSE,FALSE,TRUE
Nico,69579761,R,Des Koala,Flip Effect Monster,FLIP: Inflict 400 damage to your opponent for each card in their hand.,1100,1800,3,Beast,DARK,Koala,"DR1-EN132,5DS2-EN011,DEM1-EN010,MFC-077,","Dark Revelation Volume 1,Starter Deck: Yu-Gi-Oh! 5D's 2009,Demo Pack,Magician's Force,",,,,https://storage.googleapis.com/ygoprodeck.com/pics/69579761.jpg,https://storage.googleapis.com/ygoprodeck.com/pics_small/69579761.jpg,MFC,FALSE,FALSE,FALSE,TRUE,FALSE
Nico,69579761,R,Des Koala,Flip Effect Monster,FLIP: Inflict 400 damage to your opponent for each card in their hand.,1100,1800,3,Beast,DARK,Koala,"DR1-EN132,5DS2-EN011,DEM1-EN010,MFC-077,","Dark Revelation Volume 1,Starter Deck: Yu-Gi-Oh! 5D's 2009,Demo Pack,Magician's Force,",,,,https://storage.googleapis.com/ygoprodeck.com/pics/69579761.jpg,https://storage.googleapis.com/ygoprodeck.com/pics_small/69579761.jpg,MFC,FALSE,FALSE,FALSE,TRUE,FALSE
Nico,2326738,R,Des Lacooda,Effect Monster,Once per turn: You can change this card to face-down Defense Position. When this card is Flip Summoned: Draw 1 card.,500,600,3,Zombie,EARTH,,"AP03-EN018,GLD1-EN010,SDZW-EN013,PGD-030,","Astral Pack Three,Gold Series,Zombie World Structure Deck,Pharaonic Guardian,",,,,https://storage.googleapis.com/ygoprodeck.com/pics/2326738.jpg,https://storage.googleapis.com/ygoprodeck.com/pics_small/2326738.jpg,PGD,FALSE,FALSE,TRUE,FALSE,FALSE
Eze,71200730,R,Despair from the Dark,Effect Monster,When this card is sent from your hand or Deck to your Graveyard by an opponent's card effect: Special Summon this card.,2800,3000,8,Zombie,DARK,,"GLD5-EN008,DCR-023,SD2-EN007,DR1-EN185,LCJW-EN192,DCR-EN023,","Gold Series: Haunted Mine,Dark Crisis,Structure Deck: Zombie Madness,Dark Revelation Volume 1,Legendary Collection 4: Joey's World Mega Pack,Dark Crisis,",,,,https://storage.googleapis.com/ygoprodeck.com/pics/71200730.jpg,https://storage.googleapis.com/ygoprodeck.com/pics_small/71200730.jpg,DCR,FALSE,FALSE,FALSE,FALSE,TRUE
Eze,72192100,R,Desrook Archfiend,Effect Monster,"The controller of this card pays 500 Life Points during each of his/her Standby Phases (this is not optional). When this card is targeted by the effect of a card controlled by your opponent, when resolving the effect, roll a six-sided die. If the result is 3, negate the effect and destroy the opponent's card. When a ""Terrorking Archfiend"" on your side of the field is destroyed and sent to the Graveyard, you can send this card from your hand to the Graveyard to Special Summon the ""Terrorking Archfiend"".",1100,1800,3,Fiend,LIGHT,Archfiend,"DR1-EN232,DCR-070,DCR-EN070,","Dark Revelation Volume 1,Dark Crisis,Dark Crisis,",,,,https://storage.googleapis.com/ygoprodeck.com/pics/72192100.jpg,https://storage.googleapis.com/ygoprodeck.com/pics_small/72192100.jpg,DCR,FALSE,FALSE,FALSE,FALSE,TRUE
Eze,94212438,C,Destiny Board,Trap Card,"When this card and all 4 ""Spirit Message"" cards with different names are placed on your field, you win the Duel. Once per turn, during your opponent's End Phase: Place 1 ""Spirit Message"" card from your hand or Deck in your Spell & Trap Zone face-up, in the proper order of ""I"", ""N"", ""A"", and ""L"". When any ""Spirit Message"" card or ""Destiny Board"" you control leaves the field, send all ""Spirit Message"" cards and ""Destiny Board"" you control to the Graveyard.",,,,Continuous,,Spirit Message,"DPRP-EN041,DB2-EN021,RP02-EN045,LON-088,LON-EN088,LON-E088,","Duelist Pack: Rivals of the Pharaoh,Dark Beginning 2,Retro Pack 2,Labyrinth of Nightmare,Labyrinth of Nightmare,Labyrinth of Nightmare,",,,,https://storage.googleapis.com/ygoprodeck.com/pics/94212438.jpg,https://storage.googleapis.com/ygoprodeck.com/pics_small/94212438.jpg,LON,TRUE,FALSE,FALSE,FALSE,FALSE
Eze,5616412,R,Destruction Punch,Trap Card,"If the ATK of an attacking monster your opponent controls is lower than the DEF of the attacked Defense Position monster, destroy the attacking monster at the end of the Damage Step. (Damage calculation is applied normally.)",,,,Normal,,,"DB2-EN018,DT02-EN099,TP5-EN013,LON-085,LON-E085,LON-EN085,","Dark Beginning 2,Duel Terminal 2,Tournament Pack 5,Labyrinth of Nightmare,Labyrinth of Nightmare,Labyrinth of Nightmare,",,,,https://storage.googleapis.com/ygoprodeck.com/pics/5616412.jpg,https://storage.googleapis.com/ygoprodeck.com/pics_small/5616412.jpg,LON,TRUE,FALSE,FALSE,FALSE,FALSE
Nico,3549275,R,Dice Jar,Flip Effect Monster,"FLIP: Both players roll a six-sided die. The player with the lowest result takes damage equal to their opponent's roll x 500. However, if the winner rolled a 6, the loser takes 6000 damage. If the rolls are the same, both players roll again.",200,300,3,Rock,LIGHT,Dice ,"PGD-027,DB2-EN226,LCJW-EN262,","Pharaonic Guardian,Dark Beginning 2,Legendary Collection 4: Joey's World Mega Pack,",,,,https://storage.googleapis.com/ygoprodeck.com/pics/3549275.jpg,https://storage.googleapis.com/ygoprodeck.com/pics_small/3549275.jpg,PGD,FALSE,FALSE,TRUE,FALSE,FALSE
Eze,83241722,C,Dice Re-Roll,Trap Card,"One time, during the rest of this turn, if either player(s) rolls a die (or dice), you can have the player(s) re-roll. (You can only gain this effect once per turn.)",,,,Normal,,Dice ,"DCR-100,DR1-EN262,LCJW-EN271,DCR-EN100,","Dark Crisis,Dark Revelation Volume 1,Legendary Collection 4: Joey's World Mega Pack,Dark Crisis,",,,,https://storage.googleapis.com/ygoprodeck.com/pics/83241722.jpg,https://storage.googleapis.com/ygoprodeck.com/pics_small/83241722.jpg,DCR,FALSE,FALSE,FALSE,FALSE,TRUE
Nico,11961740,UR,Different Dimension Capsule,Spell Card,"Select 1 card from your Deck and remove it from play face-down. During your 2nd Standby Phase after activation, destroy this card and add the removed card to your hand.",,,,Normal,,,"PGD-083,DP04-EN019,DR1-EN031,","Pharaonic Guardian,Duelist Pack: Zane Truesdale,Dark Revelation Volume 1,",,,,https://storage.googleapis.com/ygoprodeck.com/pics/11961740.jpg,https://storage.googleapis.com/ygoprodeck.com/pics_small/11961740.jpg,PGD,FALSE,FALSE,TRUE,FALSE,FALSE
Eze,50939127,R,Different Dimension Dragon,Effect Monster,This card cannot be destroyed by Spell/Trap effects that do not target it. This card cannot be destroyed by battle with a monster that has 1900 or less ATK.,1200,1500,5,Dragon,LIGHT,,"DPKB-EN014,DT04-EN004,DR1-EN177,DCR-015,DCR-EN015,","Duelist Pack: Kaiba,Duel Terminal 4,Dark Revelation Volume 1,Dark Crisis,Dark Crisis,",,,,https://storage.googleapis.com/ygoprodeck.com/pics/50939127.jpg,https://storage.googleapis.com/ygoprodeck.com/pics_small/50939127.jpg,DCR,FALSE,FALSE,FALSE,FALSE,TRUE
Eze,56460688,R,Different Dimension Gate,Spell Card,Activate this card by targeting 1 monster on each side of the field; banish those targets. When this card is destroyed and sent to the Graveyard: Return those banished monsters to the field in the same battle positions they were in.,,,,Continuous,,,"BP01-EN077,BP01-EN077,BPW2-EN071,DCR-044,DR1-EN206,WGRT-EN071,DCR-EN044,","Battle Pack: Epic Dawn,Battle Pack: Epic Dawn,War of the Giants: Round 2,Dark Crisis,Dark Revelation Volume 1,War of the Giants Reinforcements,Dark Crisis,",,,,https://storage.googleapis.com/ygoprodeck.com/pics/56460688.jpg,https://storage.googleapis.com/ygoprodeck.com/pics_small/56460688.jpg,DCR,FALSE,FALSE,FALSE,FALSE,TRUE
Nico,87880531,R,Diffusion Wave-Motion,Spell Card,"(This card is not treated as a ""Fusion"" card.)\r\nPay 1000 LP, then target 1 Level 7 or higher Spellcaster-Type monster you control; this turn, only that monster can attack, and it must attack all monsters your opponent controls, once each. The effects of Effect Monsters destroyed by these attacks do not activate and are negated.",,,,Normal,,,"SD6-EN024,DPYG-EN023,LCYW-EN066,YGLD-ENB22,MFC-107,RDS-ENSE1,DR1-EN162,","Structure Deck: Spellcaster's Judgment,Duelist Pack: Yugi,Legendary Collection 3: Yugi's World Mega Pack,Yugi's Legendary Decks,Magician's Force,Rise of Destiny: Special Edition,Dark Revelation Volume 1,",,,,https://storage.googleapis.com/ygoprodeck.com/pics/87880531.jpg,https://storage.googleapis.com/ygoprodeck.com/pics_small/87880531.jpg,MFC,FALSE,FALSE,FALSE,TRUE,FALSE
Nico,87880531,R,Diffusion Wave-Motion,Spell Card,"(This card is not treated as a ""Fusion"" card.)\r\nPay 1000 LP, then target 1 Level 7 or higher Spellcaster-Type monster you control; this turn, only that monster can attack, and it must attack all monsters your opponent controls, once each. The effects of Effect Monsters destroyed by these attacks do not activate and are negated.",,,,Normal,,,"SD6-EN024,DPYG-EN023,LCYW-EN066,YGLD-ENB22,MFC-107,RDS-ENSE1,DR1-EN162,","Structure Deck: Spellcaster's Judgment,Duelist Pack: Yugi,Legendary Collection 3: Yugi's World Mega Pack,Yugi's Legendary Decks,Magician's Force,Rise of Destiny: Special Edition,Dark Revelation Volume 1,",,,,https://storage.googleapis.com/ygoprodeck.com/pics/87880531.jpg,https://storage.googleapis.com/ygoprodeck.com/pics_small/87880531.jpg,MFC,FALSE,FALSE,FALSE,TRUE,FALSE
Nico,73414375,C,Dimension Jar,Flip Effect Monster,FLIP: Both players can remove from play up to 3 monsters from their opponent's Graveyard.,200,200,2,Machine,DARK,,"DR1-EN078,MFC-023,","Dark Revelation Volume 1,Magician's Force,",,,,https://storage.googleapis.com/ygoprodeck.com/pics/73414375.jpg,https://storage.googleapis.com/ygoprodeck.com/pics_small/73414375.jpg,MFC,FALSE,FALSE,FALSE,TRUE,FALSE
Nico,73414375,C,Dimension Jar,Flip Effect Monster,FLIP: Both players can remove from play up to 3 monsters from their opponent's Graveyard.,200,200,2,Machine,DARK,,"DR1-EN078,MFC-023,","Dark Revelation Volume 1,Magician's Force,",,,,https://storage.googleapis.com/ygoprodeck.com/pics/73414375.jpg,https://storage.googleapis.com/ygoprodeck.com/pics_small/73414375.jpg,MFC,FALSE,FALSE,FALSE,TRUE,FALSE
Eze,24623598,C,Disappear,Trap Card,Remove from play 1 card from your opponent's Graveyard.,,,,Normal,,,"DB2-EN198,SYE-049,LOD-089,LOD-EN089,","Dark Beginning 2,Starter Deck: Yugi Evolution,Legacy of Darkness,Legacy of Darkness,",,,,https://storage.googleapis.com/ygoprodeck.com/pics/24623598.jpg,https://storage.googleapis.com/ygoprodeck.com/pics_small/24623598.jpg,LOD,FALSE,TRUE,FALSE,FALSE,FALSE
Nico,20727787,C,Disarmament,Trap Card,Destroy all Equip Cards on the field.,,,,Normal,,,"MFC-102,DR1-EN157,","Magician's Force,Dark Revelation Volume 1,",,,,https://storage.googleapis.com/ygoprodeck.com/pics/20727787.jpg,https://storage.googleapis.com/ygoprodeck.com/pics_small/20727787.jpg,MFC,FALSE,FALSE,FALSE,TRUE,FALSE
Nico,20727787,C,Disarmament,Trap Card,Destroy all Equip Cards on the field.,,,,Normal,,,"MFC-102,DR1-EN157,","Magician's Force,Dark Revelation Volume 1,",,,,https://storage.googleapis.com/ygoprodeck.com/pics/20727787.jpg,https://storage.googleapis.com/ygoprodeck.com/pics_small/20727787.jpg,MFC,FALSE,FALSE,FALSE,TRUE,FALSE
Nico,77561728,SR,Disturbance Strategy,Trap Card,"Your opponent shuffles their entire hand into the Deck, then draws the same number of cards.",,,,Normal,,,"OP06-EN023,DR1-EN046,PGD-098,DL15-EN019,","OTS Tournament Pack 6,Dark Revelation Volume 1,Pharaonic Guardian,Duelist League 15 participation cards,",,,,https://storage.googleapis.com/ygoprodeck.com/pics/77561728.jpg,https://storage.googleapis.com/ygoprodeck.com/pics_small/77561728.jpg,PGD,FALSE,FALSE,TRUE,FALSE,FALSE
Nico,76922029,C,Don Zaloog,Effect Monster,"When this card inflicts Battle Damage to your opponent, you can activate 1 of these effects:\n● Discard 1 random card from their hand.\n● Send the top 2 cards of their Deck to the Graveyard.",1400,1500,4,Warrior,DARK,Dark Scorpion,"GLD5-EN005,RP02-EN068,DB2-EN228,PGD-029,GLD1-EN012,","Gold Series: Haunted Mine,Retro Pack 2,Dark Beginning 2,Pharaonic Guardian,Gold Series,",,,,https://storage.googleapis.com/ygoprodeck.com/pics/76922029.jpg,https://storage.googleapis.com/ygoprodeck.com/pics_small/76922029.jpg,PGD,FALSE,FALSE,TRUE,FALSE,FALSE
Eze,3682106,C,Double Snare,Spell Card,Destroy 1 face-up card on the field that has an effect that negates Trap Cards' effects.,,,,Normal,,,"DB2-EN136,LOD-015,LOD-EN015,","Dark Beginning 2,Legacy of Darkness,Legacy of Darkness,",,,,https://storage.googleapis.com/ygoprodeck.com/pics/3682106.jpg,https://storage.googleapis.com/ygoprodeck.com/pics_small/3682106.jpg,LOD,FALSE,TRUE,FALSE,FALSE,FALSE
