Catalogador,id,Categoría,name,type,desc,atk,def,level,race,attribute,archetype,set_tag,setcode,ban_tcg,ban_ocg,ban_goat,image_url,image_url_small,booster_oficial,LON,LOD,PGD,MFC,DCR
Nico,85684223,FUSION,Reaper on the Nightmare,Fusion Monster,"""Spirit Reaper"" + ""Nightmare Horse""\nThis card is not destroyed as a result of battle. Destroy this card when it is targeted by the effect of a Spell, Trap or Effect Monster. This card can attack your opponent's Life Points directly even if there is a monster on your opponent's side of the field. If this card successfully attacks your opponent's Life Points directly, your opponent discards 1 card randomly from his/her hand.",800,600,5,Zombie,DARK,,"DR1-EN026,PGD-078,","Dark Revelation Volume 1,Pharaonic Guardian,",,,,https://storage.googleapis.com/ygoprodeck.com/pics/85684223.jpg,https://storage.googleapis.com/ygoprodeck.com/pics_small/85684223.jpg,PGD,FALSE,FALSE,TRUE,FALSE,FALSE
Nico,58577036,SR,Reasoning,Spell Card,"Your opponent declares a monster Level. Excavate cards from the top of your Deck until you excavate a monster that can be Normal Summoned/Set. If that monster is the same Level as the one declared by your opponent, send all excavated cards to the Graveyard. If not, Special Summon the excavated monster, also send the remaining cards to the Graveyard.",,,,Normal,,,"SDPL-EN027,SP14-EN041,PGD-081,BP02-EN139,BP02-EN139,SDDC-EN031,AP04-EN023,DR1-EN029,PGL3-EN080,SP14-EN041,","Structure Deck: Powercode Link,Star Pack 2014,Pharaonic Guardian,Battle Pack 2: War of the Giants,Battle Pack 2: War of the Giants,Dragons Collide Structure Deck,Astral Pack Four,Dark Revelation Volume 1,Premium Gold: Infinite Gold,Star Pack 2014,",,Limited,Limited,https://storage.googleapis.com/ygoprodeck.com/pics/58577036.jpg,https://storage.googleapis.com/ygoprodeck.com/pics_small/58577036.jpg,PGD,FALSE,FALSE,TRUE,FALSE,FALSE
Nico,37576645,R,Reckless Greed,Trap Card,Draw 2 cards and skip your next 2 Draw Phases.,,,,Normal,,Greed,"SDPL-EN038,SD1-EN025,SD2-EN027,RP02-EN071,SD8-EN033,PGD-051,SD7-EN031,BP02-EN175,BP01-EN095,BP02-EN175,DB2-EN247,BP01-EN095,LCYW-EN285,DEM3-EN018,","Structure Deck: Powercode Link,Structure Deck: Dragon's Roar,Structure Deck: Zombie Madness,Retro Pack 2,Structure Deck: Lord of the Storm,Pharaonic Guardian,Structure Deck: Invincible Fortress,Battle Pack 2: War of the Giants,Battle Pack: Epic Dawn,Battle Pack 2: War of the Giants,Dark Beginning 2,Battle Pack: Epic Dawn,Legendary Collection 3: Yugi's World Mega Pack,Demo Deck 2016,",Limited,,,https://storage.googleapis.com/ygoprodeck.com/pics/37576645.jpg,https://storage.googleapis.com/ygoprodeck.com/pics_small/37576645.jpg,PGD,FALSE,FALSE,TRUE,FALSE,FALSE
Eze,2851070,SR,Reflect Bounder,Effect Monster,"Before damage calculation, if this card is being attacked by an opponent's monster, and was in face-up Attack Position at the start of the Damage Step: Inflict damage to your opponent equal to the attacking monster's ATK. If you do, after damage calculation: Destroy this card.",1700,1000,4,Machine,LIGHT,,"TU02-EN017,SDCR-EN016,CP01-EN009,DCR-012,DR1-EN174,DCR-EN012,","Turbo Pack: Booster Two,Cyber Dragon Revolution Structure Deck,Champion Pack: Game One,Dark Crisis,Dark Revelation Volume 1,Dark Crisis,",,,Limited,https://storage.googleapis.com/ygoprodeck.com/pics/2851070.jpg,https://storage.googleapis.com/ygoprodeck.com/pics_small/2851070.jpg,DCR,FALSE,FALSE,FALSE,FALSE,TRUE
Eze,32807846,R,Reinforcement of the Army,Spell Card,Add 1 Level 4 or lower Warrior-Type monster from your Deck to your hand.,,,,Normal,,,"LEHD-ENC18,YS12-EN027,LEDD-ENA27,WIRA-EN052,SDSE-EN028,SR02-EN031,SDHS-EN032,SDDE-EN022,YS14-ENA09,SD5-EN024,SDWS-EN025,5DS3-EN022,YS13-EN029,DASA-EN053,SDWA-EN025,LCYW-EN173,NKRT-EN026,LOD-028,DB2-EN147,PGLD-EN058,LCJW-EN286,GLD1-EN032,HL06-EN004,LOD-EN028,","Legendary Hero Decks,Starter Deck: Xyz Symphony,Legendary Dragon Decks,Wing Raiders,Synchron Extreme Structure Deck,Rise of the True Dragons Structure Deck,HERO Strike Structure Deck,The Dark Emperor Structure Deck,Space-Time Showdown Power-Up Pack,Structure Deck: Warrior's Triumph,Warriors' Strike Structure Deck,Starter Deck: Duelist Toolbox,Super Starter: V for Victory,Dark Saviors,Samurai Warlords Structure Deck,Legendary Collection 3: Yugi's World Mega Pack,Noble Knights of the Round Table Box Set,Legacy of Darkness,Dark Beginning 2,Premium Gold,Legendary Collection 4: Joey's World Mega Pack,Gold Series,Hobby League 6 participation card D,Legacy of Darkness,",Limited,Limited,Semi-Limited,https://storage.googleapis.com/ygoprodeck.com/pics/32807846.jpg,https://storage.googleapis.com/ygoprodeck.com/pics_small/32807846.jpg,LOD,FALSE,TRUE,FALSE,FALSE,FALSE
Nico,94739788,C,Remove Brainwashing,Trap Card,The control of all monsters on the field returns to the owners.,,,,Continuous,,,"PGL3-EN091,MFC-101,DR1-EN156,","Premium Gold: Infinite Gold,Magician's Force,Dark Revelation Volume 1,",,,,https://storage.googleapis.com/ygoprodeck.com/pics/94739788.jpg,https://storage.googleapis.com/ygoprodeck.com/pics_small/94739788.jpg,MFC,FALSE,FALSE,FALSE,TRUE,FALSE
Nico,94739788,C,Remove Brainwashing,Trap Card,The control of all monsters on the field returns to the owners.,,,,Continuous,,,"PGL3-EN091,MFC-101,DR1-EN156,","Premium Gold: Infinite Gold,Magician's Force,Dark Revelation Volume 1,",,,,https://storage.googleapis.com/ygoprodeck.com/pics/94739788.jpg,https://storage.googleapis.com/ygoprodeck.com/pics_small/94739788.jpg,MFC,FALSE,FALSE,FALSE,TRUE,FALSE
Eze,19827717,SR,Return of the Doomed,Spell Card,Discard 1 Monster Card from your hand to the Graveyard. Return 1 of your monsters destroyed and sent to your Graveyard as a result of battle during this turn to your hand at the end of this turn.,,,,Normal,,,"DB1-EN224,LON-021,LON-EN021,LON-E021,","Dark Beginning 1,Labyrinth of Nightmare,Labyrinth of Nightmare,Labyrinth of Nightmare,",,,,https://storage.googleapis.com/ygoprodeck.com/pics/19827717.jpg,https://storage.googleapis.com/ygoprodeck.com/pics_small/19827717.jpg,LON,TRUE,FALSE,FALSE,FALSE,FALSE
Nico,5990062,R,Reversal Quiz,Spell Card,"Send all cards in your hand and on your side of the field to the Graveyard. Call the type of card (Spell, Trap, or Monster) on top of your Deck. If you call it right, exchange your current Life Points with your opponent's current ones.",,,,Normal,,,"PGD-092,DR1-EN040,","Pharaonic Guardian,Dark Revelation Volume 1,",,,,https://storage.googleapis.com/ygoprodeck.com/pics/5990062.jpg,https://storage.googleapis.com/ygoprodeck.com/pics_small/5990062.jpg,PGD,FALSE,FALSE,TRUE,FALSE,FALSE
Eze,31709826,R,Revival Jam,Effect Monster,When this card is destroyed by battle and sent to the Graveyard: You can pay 1000 Life Points; Special Summon it in face-up Defense Position during your next turn's Standby Phase.,1500,500,4,Aqua,WATER,Slime,"RP02-EN028,BP02-EN010,DB1-EN210,LCJW-EN113,LON-006,BP02-EN010,LON-EN006,LON-E006,","Retro Pack 2,Battle Pack 2: War of the Giants,Dark Beginning 1,Legendary Collection 4: Joey's World Mega Pack,Labyrinth of Nightmare,Battle Pack 2: War of the Giants,Labyrinth of Nightmare,Labyrinth of Nightmare,",,,,https://storage.googleapis.com/ygoprodeck.com/pics/31709826.jpg,https://storage.googleapis.com/ygoprodeck.com/pics_small/31709826.jpg,LON,TRUE,FALSE,FALSE,FALSE,FALSE
Nico,83555666,UR,Ring of Destruction,Trap Card,"During your opponent's turn: Target 1 face-up monster your opponent controls whose ATK is less than or equal to their LP; destroy that face-up monster, and if you do, take damage equal to its original ATK, then inflict damage to your opponent, equal to the damage you took. You can only activate 1 ""Ring of Destruction"" per turn.",,,,Normal,,,"YS17-EN036,SDKS-EN033,MIL1-EN023,PGL2-EN063,LCKC-EN050,BP01-EN050,CP02-EN008,BP01-EN050,IOC-SE3,PGD-000,DPKB-EN036,LART-EN007,RP02-EN066,","Starter Deck: Link Strike,Structure Deck: Seto Kaiba,Millennium Pack,Premium Gold: Return of the Bling,Legendary Collection Kaiba Mega Pack,Battle Pack: Epic Dawn,Champion Pack: Game Two,Battle Pack: Epic Dawn,Invasion of Chaos: Special Edition,Pharaonic Guardian,Duelist Pack: Kaiba,The Lost Art Promotion G,Retro Pack 2,",Limited,,,https://storage.googleapis.com/ygoprodeck.com/pics/83555666.jpg,https://storage.googleapis.com/ygoprodeck.com/pics_small/83555666.jpg,PGD,FALSE,FALSE,TRUE,FALSE,FALSE
Nico,83555667,UR,Ring of Destruction,Trap Card,"During your opponent's turn: Target 1 face-up monster your opponent controls whose ATK is less than or equal to their LP; destroy that face-up monster, and if you do, take damage equal to its original ATK, then inflict damage to your opponent, equal to the damage you took. You can only activate 1 ""Ring of Destruction"" per turn.",,,,Normal,,,"YS17-EN036,SDKS-EN033,MIL1-EN023,PGL2-EN063,LCKC-EN050,BP01-EN050,CP02-EN008,BP01-EN050,IOC-SE3,PGD-000,DPKB-EN036,LART-EN007,RP02-EN066,","Starter Deck: Link Strike,Structure Deck: Seto Kaiba,Millennium Pack,Premium Gold: Return of the Bling,Legendary Collection Kaiba Mega Pack,Battle Pack: Epic Dawn,Champion Pack: Game Two,Battle Pack: Epic Dawn,Invasion of Chaos: Special Edition,Pharaonic Guardian,Duelist Pack: Kaiba,The Lost Art Promotion G,Retro Pack 2,",Limited,,,https://storage.googleapis.com/ygoprodeck.com/pics/83555667.jpg,https://storage.googleapis.com/ygoprodeck.com/pics_small/83555667.jpg,PGD,FALSE,FALSE,TRUE,FALSE,FALSE
Eze,70344351,SR,Riryoku Field,Trap Card,"When a Spell Card that targets exactly 1 monster on the field (and no other cards) is activated: Negate the activation, and if you do, destroy it.",,,,Counter,,,"BPW2-EN080,SKE-048,LON-081,DB2-EN015,WGRT-EN080,LON-E081,LON-EN081,","War of the Giants: Round 2,Starter Deck: Kaiba Evolution,Labyrinth of Nightmare,Dark Beginning 2,War of the Giants Reinforcements,Labyrinth of Nightmare,Labyrinth of Nightmare,",,,,https://storage.googleapis.com/ygoprodeck.com/pics/70344351.jpg,https://storage.googleapis.com/ygoprodeck.com/pics_small/70344351.jpg,LON,TRUE,FALSE,FALSE,FALSE,FALSE
Nico,30450531,SR,Rite of Spirit,Trap Card,"Target 1 ""Gravekeeper's"" monster in your Graveyard; Special Summon that target. This card's activation and effect are unaffected by ""Necrovalley"".",,,,Normal,,Gravekeeper's,"SS01-ENB16,PGD-100,DR1-EN048,LCYW-EN196,DL11-EN019,","Speed Duel Starter Decks: Destiny Masters,Pharaonic Guardian,Dark Revelation Volume 1,Legendary Collection 3: Yugi's World Mega Pack,Duelist League 2 participation cards,",,,,https://storage.googleapis.com/ygoprodeck.com/pics/30450531.jpg,https://storage.googleapis.com/ygoprodeck.com/pics_small/30450531.jpg,PGD,FALSE,FALSE,TRUE,FALSE,FALSE
Nico,90846359,UR,Rivalry of Warlords,Trap Card,Each player can only control 1 Type of monster. Send all other face-up monsters they control to the Graveyard.,,,,Continuous,,,"DR1-EN103,SDWA-EN033,MFC-048,GLD1-EN043,HISU-EN059,","Dark Revelation Volume 1,Samurai Warlords Structure Deck,Magician's Force,Gold Series,Hidden Summoners,",,,,https://storage.googleapis.com/ygoprodeck.com/pics/90846359.jpg,https://storage.googleapis.com/ygoprodeck.com/pics_small/90846359.jpg,MFC,FALSE,FALSE,FALSE,TRUE,FALSE
Nico,90846359,UR,Rivalry of Warlords,Trap Card,Each player can only control 1 Type of monster. Send all other face-up monsters they control to the Graveyard.,,,,Continuous,,,"DR1-EN103,SDWA-EN033,MFC-048,GLD1-EN043,HISU-EN059,","Dark Revelation Volume 1,Samurai Warlords Structure Deck,Magician's Force,Gold Series,Hidden Summoners,",,,,https://storage.googleapis.com/ygoprodeck.com/pics/90846359.jpg,https://storage.googleapis.com/ygoprodeck.com/pics_small/90846359.jpg,MFC,FALSE,FALSE,FALSE,TRUE,FALSE
Eze,92421852,C,Robolady,Normal Monster,"A warrior fully covered with metal. It upgrades by fusing with ""Roboyarou"".",450,900,3,Machine,EARTH,,"LOD-054,LOD-EN054,","Legacy of Darkness,Legacy of Darkness,",,,,https://storage.googleapis.com/ygoprodeck.com/pics/92421852.jpg,https://storage.googleapis.com/ygoprodeck.com/pics_small/92421852.jpg,LOD,FALSE,TRUE,FALSE,FALSE,FALSE
Eze,44203504,R,Robotic Knight,Normal Monster,"The Commander of Machine-Types, he serves the Machine King. He is famous for the way he controls his troops.",1600,1800,4,Machine,FIRE,,"YSDS-EN002,DEM2-EN007,LOD-051,LOD-EN051,","Starter Deck: Syrus Truesdale,Demo Deck 2015,Legacy of Darkness,Legacy of Darkness,",,,,https://storage.googleapis.com/ygoprodeck.com/pics/44203504.jpg,https://storage.googleapis.com/ygoprodeck.com/pics_small/44203504.jpg,LOD,FALSE,TRUE,FALSE,FALSE,FALSE
Eze,38916461,C,Roboyarou,Normal Monster,"A warrior fully covered with metal. It upgrades by fusing with ""Robolady"".",900,450,3,Machine,EARTH,,"LOD-055,LOD-EN055,","Legacy of Darkness,Legacy of Darkness,",,,,https://storage.googleapis.com/ygoprodeck.com/pics/38916461.jpg,https://storage.googleapis.com/ygoprodeck.com/pics_small/38916461.jpg,LOD,FALSE,TRUE,FALSE,FALSE,FALSE
Eze,95515060,SR,Rod of Silence - Kay'est,Spell Card,"The equipped monster gains 500 DEF. Negate other Spell effects that target the equipped monster, and if you do, destroy that Spell Card.",,,,Equip,,Guardian,"DR1-EN198,DCR-036,LCYW-EN140,DCR-EN036,","Dark Revelation Volume 1,Dark Crisis,Legendary Collection 3: Yugi's World Mega Pack,Dark Crisis,",,,,https://storage.googleapis.com/ygoprodeck.com/pics/95515060.jpg,https://storage.googleapis.com/ygoprodeck.com/pics_small/95515060.jpg,DCR,FALSE,FALSE,FALSE,FALSE,TRUE
Eze,94793422,R,Rod of the Mind's Eye,Spell Card,"If a monster equipped with this card inflicts Battle Damage to your opponent, the damage becomes 1000 points.",,,,Equip,,,"DR1-EN201,DCR-039,DCR-EN039,","Dark Revelation Volume 1,Dark Crisis,Dark Crisis,",,,,https://storage.googleapis.com/ygoprodeck.com/pics/94793422.jpg,https://storage.googleapis.com/ygoprodeck.com/pics_small/94793422.jpg,DCR,FALSE,FALSE,FALSE,FALSE,TRUE
Nico,93382620,SR,Rope of Life,Trap Card,"When a monster(s) is destroyed by battle and sent to your Graveyard: Discard your entire hand (min.1), then target 1 of those monsters; Special Summon it, and if you do, it gains 800 ATK.",,,,Normal,,,"BP02-EN176,BP02-EN176,LCJW-EN133,LCYW-EN147,5DS3-EN033,DR1-EN054,PGD-105,SD2-ENDE1,","Battle Pack 2: War of the Giants,Battle Pack 2: War of the Giants,Legendary Collection 4: Joey's World Mega Pack,Legendary Collection 3: Yugi's World Mega Pack,Starter Deck: Duelist Toolbox,Dark Revelation Volume 1,Pharaonic Guardian,Structure Deck: Deluxe Edition,",,,,https://storage.googleapis.com/ygoprodeck.com/pics/93382620.jpg,https://storage.googleapis.com/ygoprodeck.com/pics_small/93382620.jpg,PGD,FALSE,FALSE,TRUE,FALSE,FALSE
Nico,46303688,SR,Roulette Barrel,Effect Monster,"Once per turn: You can roll a six-sided die twice, choose 1 result, and destroy 1 monster on the field whose Level is equal to that result.",1000,2000,4,Machine,LIGHT,,"DR1-EN080,LCJW-EN263,MFC-025,","Dark Revelation Volume 1,Legendary Collection 4: Joey's World Mega Pack,Magician's Force,",,,,https://storage.googleapis.com/ygoprodeck.com/pics/46303688.jpg,https://storage.googleapis.com/ygoprodeck.com/pics_small/46303688.jpg,MFC,FALSE,FALSE,FALSE,TRUE,FALSE
Nico,46303688,SR,Roulette Barrel,Effect Monster,"Once per turn: You can roll a six-sided die twice, choose 1 result, and destroy 1 monster on the field whose Level is equal to that result.",1000,2000,4,Machine,LIGHT,,"DR1-EN080,LCJW-EN263,MFC-025,","Dark Revelation Volume 1,Legendary Collection 4: Joey's World Mega Pack,Magician's Force,",,,,https://storage.googleapis.com/ygoprodeck.com/pics/46303688.jpg,https://storage.googleapis.com/ygoprodeck.com/pics_small/46303688.jpg,MFC,FALSE,FALSE,FALSE,TRUE,FALSE
Eze,33950246,R,Royal Command,Trap Card,"Flip monsters' effects cannot be activated, also their effects are negated.",,,,Continuous,,,"AP06-EN027,DB2-EN014,TU05-EN020,GLD1-EN042,LON-080,LON-EN080,LON-E080,","Astral Pack Six,Dark Beginning 2,Turbo Pack: Booster Five,Gold Series,Labyrinth of Nightmare,Labyrinth of Nightmare,Labyrinth of Nightmare,",,,,https://storage.googleapis.com/ygoprodeck.com/pics/33950246.jpg,https://storage.googleapis.com/ygoprodeck.com/pics_small/33950246.jpg,LON,TRUE,FALSE,FALSE,FALSE,FALSE
Nico,16509093,R,Royal Keeper,Effect Monster,"Once per turn, you can flip this card into face-down Defense Position. When this card is flipped face-up, it gains 300 ATK and DEF until the end of the turn. (If attacked, this effect resolves after damage calculation.)",1600,1700,4,Zombie,EARTH,,"DB2-EN218,SDZW-EN006,PGD-018,","Dark Beginning 2,Zombie World Structure Deck,Pharaonic Guardian,",,,,https://storage.googleapis.com/ygoprodeck.com/pics/16509093.jpg,https://storage.googleapis.com/ygoprodeck.com/pics_small/16509093.jpg,PGD,FALSE,FALSE,TRUE,FALSE,FALSE
Nico,70791313,SR,Royal Magical Library,Effect Monster,"Each time a Spell Card is activated, place 1 Spell Counter on this card when that Spell resolves (max. 3). You can remove 3 Spell Counters from this card; draw 1 card.",0,2000,4,Spellcaster,LIGHT,,"DR1-EN129,MFC-074,SD6-EN010,SYE-023,SDSC-EN013,OP07-EN004,","Dark Revelation Volume 1,Magician's Force,Structure Deck: Spellcaster's Judgment,Starter Deck: Yugi Evolution,Spellcaster's Command Structure Deck,OTS Tournament Pack 7,",,,,https://storage.googleapis.com/ygoprodeck.com/pics/70791313.jpg,https://storage.googleapis.com/ygoprodeck.com/pics_small/70791313.jpg,MFC,FALSE,FALSE,FALSE,TRUE,FALSE
Nico,70791313,SR,Royal Magical Library,Effect Monster,"Each time a Spell Card is activated, place 1 Spell Counter on this card when that Spell resolves (max. 3). You can remove 3 Spell Counters from this card; draw 1 card.",0,2000,4,Spellcaster,LIGHT,,"DR1-EN129,MFC-074,SD6-EN010,SYE-023,SDSC-EN013,OP07-EN004,","Dark Revelation Volume 1,Magician's Force,Structure Deck: Spellcaster's Judgment,Starter Deck: Yugi Evolution,Spellcaster's Command Structure Deck,OTS Tournament Pack 7,",,,,https://storage.googleapis.com/ygoprodeck.com/pics/70791313.jpg,https://storage.googleapis.com/ygoprodeck.com/pics_small/70791313.jpg,MFC,FALSE,FALSE,FALSE,TRUE,FALSE
Eze,93016201,SR,Royal Oppression,Trap Card,"Either player can pay 800 Life Points to negate the Special Summon of a monster(s), and/or an effect that Special Summons a monster(s), and destroy those cards.",,,,Continuous,,,"LOD-091,DB2-EN200,CP08-EN013,GLD4-EN047,DT04-EN048,LOD-EN091,","Legacy of Darkness,Dark Beginning 2,Champion Pack: Game Eight,Gold Series 4: Pyramids Edition,Duel Terminal 4,Legacy of Darkness,",Banned,Banned,,https://storage.googleapis.com/ygoprodeck.com/pics/93016201.jpg,https://storage.googleapis.com/ygoprodeck.com/pics_small/93016201.jpg,LOD,FALSE,TRUE,FALSE,FALSE,FALSE
Nico,72405967,C,Royal Tribute,Spell Card,"If you control ""Necrovalley"": Both players discard any monsters in their hands.",,,,Normal,,Gravekeeper's,"DR1-EN039,PGD-091,DL11-EN017,LCYW-EN195,","Dark Revelation Volume 1,Pharaonic Guardian,Duelist League 2 participation cards,Legendary Collection 3: Yugi's World Mega Pack,",,Limited,,https://storage.googleapis.com/ygoprodeck.com/pics/72405967.jpg,https://storage.googleapis.com/ygoprodeck.com/pics_small/72405967.jpg,PGD,FALSE,FALSE,TRUE,FALSE,FALSE
Eze,49868263,FUSION,Ryu Senshi,Fusion Monster,"""Warrior Dai Grepher"" + ""Spirit Ryu""\nA Fusion Summon of this monster can only be conducted with the above Fusion Material Monsters. As long as this card remains face-up on the field, negate the effect of a Normal Trap Card by paying 1000 Life Points. Negate the effects of a Spell Card that targets this card and destroy it.",2000,1200,6,Warrior,EARTH,,"DB2-EN139,TP6-EN011,LOD-019,LOD-EN019,","Dark Beginning 2,Tournament Pack 6,Legacy of Darkness,Legacy of Darkness,",,,,https://storage.googleapis.com/ygoprodeck.com/pics/49868263.jpg,https://storage.googleapis.com/ygoprodeck.com/pics_small/49868263.jpg,LOD,FALSE,TRUE,FALSE,FALSE,FALSE
Eze,42647539,R,Ryu-Kishin Clown,Effect Monster,"When this card is Summoned (including Flip Summon and Special Summon), select 1 face-up monster on the field and change its battle position.",800,500,2,Fiend,DARK,,"LOD-007,LOD-EN007,","Legacy of Darkness,Legacy of Darkness,",,,,https://storage.googleapis.com/ygoprodeck.com/pics/42647539.jpg,https://storage.googleapis.com/ygoprodeck.com/pics_small/42647539.jpg,LOD,FALSE,TRUE,FALSE,FALSE,FALSE
Eze,56120475,UR,Sakuretsu Armor,Trap Card,When an opponent's monster declares an attack: Target the attacking monster; destroy that target.,,,,Normal,,,"5DS3-EN035,5DS1-EN037,YSDS-EN035,SDDE-EN033,YSD-EN037,YSDJ-EN036,SDWS-EN034,SD10-EN033,DR1-EN264,DCR-102,SDRL-EN036,DEM2-EN018,YSKR-EN043,SD8-EN034,YS14-EN032,DL09-EN018,LCYW-EN288,DCR-EN102,CP01-EN004,","Starter Deck: Duelist Toolbox,Starter Deck: Yu-Gi-Oh! 5D's,Starter Deck: Syrus Truesdale,The Dark Emperor Structure Deck,Starter Deck 2006,Starter Deck: Jaden Yuki,Warriors' Strike Structure Deck,Structure Deck: Machine Re-Volt,Dark Revelation Volume 1,Dark Crisis,Rise of the Dragon Lords Structure Deck,Demo Deck 2015,Starter Deck: Kaiba Reloaded,Structure Deck: Lord of the Storm,Super Starter: Space-Time Showdown,Duelist League 2010 participation cards,Legendary Collection 3: Yugi's World Mega Pack,Dark Crisis,Champion Pack: Game One,",,,,https://storage.googleapis.com/ygoprodeck.com/pics/56120475.jpg,https://storage.googleapis.com/ygoprodeck.com/pics_small/56120475.jpg,DCR,FALSE,FALSE,FALSE,FALSE,TRUE
Nico,16222645,SR,Sasuke Samurai,Effect Monster,"At the start of the Damage Step, if this card attacks a face-down Defense Position monster: Destroy that face-down monster.",500,800,2,Warrior,WIND,,"LCJW-EN034,DB2-EN216,PGD-015,5DS2-EN010,","Legendary Collection 4: Joey's World Mega Pack,Dark Beginning 2,Pharaonic Guardian,Starter Deck: Yu-Gi-Oh! 5D's 2009,",,,,https://storage.googleapis.com/ygoprodeck.com/pics/16222645.jpg,https://storage.googleapis.com/ygoprodeck.com/pics_small/16222645.jpg,PGD,FALSE,FALSE,TRUE,FALSE,FALSE
Eze,11760174,C,Sasuke Samurai 2,Effect Monster,"Once per turn, during your Main Phase, you can pay 800 Life Points. If you do this, until the End Phase, Spell and Trap Cards cannot be activated.",200,300,1,Warrior,WIND,,"DCR-059,DR1-EN221,DCR-EN059,","Dark Crisis,Dark Revelation Volume 1,Dark Crisis,",,,,https://storage.googleapis.com/ygoprodeck.com/pics/11760174.jpg,https://storage.googleapis.com/ygoprodeck.com/pics_small/11760174.jpg,DCR,FALSE,FALSE,FALSE,FALSE,TRUE
Eze,10352095,R,Scroll of Bewitchment,Spell Card,Select 1 Attribute. Change the Attribute of the equipped monster to the one you select.,,,,Equip,,,"DB1-EN243,LON-048,LON-E048,LON-EN048,","Dark Beginning 1,Labyrinth of Nightmare,Labyrinth of Nightmare,Labyrinth of Nightmare,",,,,https://storage.googleapis.com/ygoprodeck.com/pics/10352095.jpg,https://storage.googleapis.com/ygoprodeck.com/pics_small/10352095.jpg,LON,TRUE,FALSE,FALSE,FALSE,FALSE
Eze,36562627,C,Second Coin Toss,Spell Card,"When a coin toss is performed, you can choose to redo the coin toss. (If the toss involved multiple coin flips, redo all of them.) You can only use the effect of ""Second Coin Toss"" once per turn.",,,,Continuous,,,"LCJW-EN268,DB2-EN192,LOD-083,LOD-EN083,","Legendary Collection 4: Joey's World Mega Pack,Dark Beginning 2,Legacy of Darkness,Legacy of Darkness,",,,,https://storage.googleapis.com/ygoprodeck.com/pics/36562627.jpg,https://storage.googleapis.com/ygoprodeck.com/pics_small/36562627.jpg,LOD,FALSE,TRUE,FALSE,FALSE,FALSE
Nico,19086954,C,Second Goblin,Union Effect Monster,"Once per turn, during your Main Phase, if you control this monster on the field, you can equip it to your ""Giant Orc"" as an Equip Card, OR unequip the Union equipment and Special Summon this card in face-up Attack Position. While equipped to a monster by this card's effect, you can change the equipped monster's battle position once per turn. (1 monster can only be equipped with 1 Union Monster at a time. If the equipped monster is destroyed as a result of battle, destroy this card instead.)",100,100,1,Fiend,DARK,,"DR1-EN068,MFC-013,","Dark Revelation Volume 1,Magician's Force,",,,,https://storage.googleapis.com/ygoprodeck.com/pics/19086954.jpg,https://storage.googleapis.com/ygoprodeck.com/pics_small/19086954.jpg,MFC,FALSE,FALSE,FALSE,TRUE,FALSE
Nico,19086954,C,Second Goblin,Union Effect Monster,"Once per turn, during your Main Phase, if you control this monster on the field, you can equip it to your ""Giant Orc"" as an Equip Card, OR unequip the Union equipment and Special Summon this card in face-up Attack Position. While equipped to a monster by this card's effect, you can change the equipped monster's battle position once per turn. (1 monster can only be equipped with 1 Union Monster at a time. If the equipped monster is destroyed as a result of battle, destroy this card instead.)",100,100,1,Fiend,DARK,,"DR1-EN068,MFC-013,","Dark Revelation Volume 1,Magician's Force,",,,,https://storage.googleapis.com/ygoprodeck.com/pics/19086954.jpg,https://storage.googleapis.com/ygoprodeck.com/pics_small/19086954.jpg,MFC,FALSE,FALSE,FALSE,TRUE,FALSE
Nico,27053506,R,Secret Barrel,Trap Card,Inflict 200 damage to your opponent for each card in their hand and for each card they control.,,,,Normal,,,"5DS3-EN034,DEM1-EN017,MFC-046,DR1-EN101,","Starter Deck: Duelist Toolbox,Demo Pack,Magician's Force,Dark Revelation Volume 1,",,,,https://storage.googleapis.com/ygoprodeck.com/pics/27053506.jpg,https://storage.googleapis.com/ygoprodeck.com/pics_small/27053506.jpg,MFC,FALSE,FALSE,FALSE,TRUE,FALSE
Nico,27053506,R,Secret Barrel,Trap Card,Inflict 200 damage to your opponent for each card in their hand and for each card they control.,,,,Normal,,,"5DS3-EN034,DEM1-EN017,MFC-046,DR1-EN101,","Starter Deck: Duelist Toolbox,Demo Pack,Magician's Force,Dark Revelation Volume 1,",,,,https://storage.googleapis.com/ygoprodeck.com/pics/27053506.jpg,https://storage.googleapis.com/ygoprodeck.com/pics_small/27053506.jpg,MFC,FALSE,FALSE,FALSE,TRUE,FALSE
